{
  "schema_version": "1.0.0",
  "generator": "claude-account-migration",
  "created_utc": "2026-09-10",
  "last_updated_utc": "2026-09-10",
  "migration_status": "awaiting-first-upload",
  "completion_confirmed_by_user": false,
  "notes": "No source data has been received. All entity collections are intentionally empty. Populated only from supplied sources; no inferred or invented records.",
  "counts": {
    "batches": 0,
    "conversations": 0,
    "projects": 0,
    "prompts": 0,
    "files": 0,
    "artifacts": 0,
    "decisions": 0,
    "open_items": 0,
    "issues": 0,
    "secrets": 0
  },
  "id_scheme": {
    "conversation": "CONV-####",
    "project": "PROJ-####",
    "prompt": "PROMPT-####",
    "file": "FILE-####",
    "artifact": "ART-####",
    "decision": "DEC-####",
    "open_item": "TASK-####",
    "issue": "ISSUE-####",
    "secret": "SEC-####",
    "batch": "BATCH-##",
    "stability": "Assigned in order of first encounter. Never reused, never renumbered, retained even when a record is superseded, deduplicated, or found unreadable."
  },
  "confidence_values": ["high", "medium", "low"],
  "batches": [],
  "conversations": [],
  "projects": [],
  "prompts": [],
  "files": [],
  "artifacts": [],
  "decisions": [],
  "open_items": [],
  "issues": [],
  "secrets": []
}
